dataset,model,question,answer__baseline,answer__hcpc_v1,answer__hcpc_v2,ccs__baseline,ccs__hcpc_v1,ccs__hcpc_v2,faithfulness_score__baseline,faithfulness_score__hcpc_v1,faithfulness_score__hcpc_v2,is_hallucination__baseline,is_hallucination__hcpc_v1,is_hallucination__hcpc_v2,mean_retrieval_similarity__baseline,mean_retrieval_similarity__hcpc_v1,mean_retrieval_similarity__hcpc_v2,refined__baseline,refined__hcpc_v1,refined__hcpc_v2,baseline_halluc,v2_halluc,v2_refined,category,faith_drop
naturalqs,mistral,what is a e8 in the marine corps," An E-8 in the Marine Corps refers to a non-commissioned officer at the 8th pay grade. The context does not provide specific ranks for E-8, but it mentions that there are two ranks per pay grade with different responsibilities."," The provided context does not specify the exact titles for each pay grade at the E-8 level. However, it does mention that there are two ranks per pay grade, so an E-8 could be either of those two ranks. Without more specific information, I cannot determine which rank specifically an E-8 is in the Marine Corps."," An E-8 in the Marine Corps refers to a Staff Noncommissioned Officer (SNCO) with two ranks at this pay grade, each with different responsibilities. The provided context does not specify the names of these ranks for an E-8.",-1.0,-1.0,0.6481,0.7193,0.5839,0.4613,False,False,True,0.4483,0.5525,0.4434,False,False,True,False,True,True,"type-A: gate fired, refinement made it worse",0.25800000000000006
hotpotqa,mistral,Who directed the second film in a British series of action comedy film parodying the James Bond secret agent genre with comedy similar to Rowan Atkinson's Mr. Bean character?," I cannot find this information in the provided context as it only discusses the first and third films, not the second one.", I cannot find this information in the provided context. The context does not mention who directed the second film in the Johnny English series.," I cannot find this information in the provided context as it only discusses the first and original Johnny English film, and does not mention any directors for the subsequent films.",-1.0,-1.0,0.3739,0.4855,0.7217,0.2496,True,False,True,0.6703,0.7085,0.6703,False,False,False,True,True,False,type-B: gate did not fire on baseline-incoherent set,0.2359
hotpotqa,llama3," Jason Regler, stated that he had the idea for the flashing wristbands during a song built around which instrument ?","According to the provided context, Jason Regler stated that he had the idea for the flashing wristbands while at a Coldplay concert, during the song ""Fix You"". Therefore, the answer is:

""piano"" (since there is no mention of any other instrument in the context)","According to the provided context, Jason Regler stated that he had the idea for the flashing wristbands while at a Coldplay concert, during the song ""Fix You"". Therefore, the answer is:

Piano","According to the provided context, Jason Regler stated that he had the idea for the flashing wristbands while at a Coldplay concert, during the song ""Fix You"".",-1.0,-1.0,0.1366,0.6407,0.5081,0.4296,False,False,True,0.306,0.5093,0.3044,False,False,True,False,True,True,"type-A: gate fired, refinement made it worse",0.21110000000000007
hotpotqa,mistral,Who will Billy Howle be seen opposite in the upcoming British drama film directed by Dominic Cooke?," I cannot find information about who Billy Howle will be seen opposite in an upcoming British drama film directed by Dominic Cooke, as there is no such information provided in the context."," Saoirse Ronan, according to the provided context.", I cannot find this information in the provided context as it does not mention any upcoming British drama film directed by Dominic Cooke featuring Billy Howle.,-1.0,-1.0,0.2865,0.5831,0.643,0.3807,False,False,True,0.4522,0.4514,0.4526,False,False,True,False,True,True,"type-A: gate fired, refinement made it worse",0.20239999999999997
pubmedqa,mistral,Israeli hospital preparedness for terrorism-related multiple casualty incidents: can the surge capacity and injury severity distribution be better predicted?," Based on the provided context, it is stated that the Emergency and Disaster Medicine Division in the Israeli Ministry of Health defined a key of 20 percent of each hospital's bed capacity as its readiness for multiple casualties. The study also provides data on the number of casualties and their severity in various HMCIs that occurred between November 2000 and June 2003. However, the context does not provide information on whether or how well the surge capacity and injury severity distribution can be better predicted."," Based on the provided context, it is not explicitly stated whether the surge capacity and injury severity distribution in Israeli hospitals for terrorism-related multiple casualty incidents can be better predicted. The study evaluates the efficacy of the current readiness guidelines based on the epidemiology of encountered HMCIs, but it does not mention predicting surge capacity or injury severity distribution."," Based on the provided context, it is stated that the Emergency and Disaster Medicine Division in the Israeli Ministry of Health defined a key of 20 percent of each hospital's bed capacity as its readiness for multiple casualties. The study evaluates the efficacy of this readiness guideline based on the epidemiology of encountered HMCIs, but it does not provide information about whether the surge capacity and injury severity distribution can be better predicted.",-1.0,-1.0,0.366,0.6459,0.4306,0.4458,False,True,True,0.557,0.5462,0.5639,False,False,True,False,True,True,"type-A: gate fired, refinement made it worse",0.20010000000000006
pubmedqa,mistral,Amblyopia: is visual loss permanent?," Based on the provided context, it appears that some cases of amblyopia may improve over time, but the text does not explicitly state whether visual loss due to amblyopia is permanently irreversible. The improvement in visual acuity for amblyopic eyes in the study was significant, with a mean improvement of 3.3 lines in distance acuity and 1.9 lines in near acuity over a period of 12 months. However, it's important to note that this is just one study and results may vary for different individuals."," The provided context does not explicitly state that amblyopia causes permanent visual loss. However, it does mention that in 9 out of 12 cases where an improvement in visual acuity was detected, the affected eye had a history of amblyopia. This suggests that while visual acuity may improve, there could be residual effects or potential for recurrence associated with amblyopia. For definitive information about the permanence of visual loss due to amblyopia, further research and context would be required."," Based on the provided context, it is not explicitly stated that amblyopia causes permanent visual loss. However, in the first context, it is mentioned that cases were found where an improvement of one or more lines of either distance or near acuity was recorded in the eye unaffected by macular disease, and in nine of these cases, the eye showing improvement had a history of amblyopia. This suggests that some degree of visual improvement can occur even with a history of amblyopia. Therefore, it is possible that visual loss due to amblyopia may not always be permanent.",-1.0,-1.0,0.6825,0.4945,0.3756,0.3018,True,True,True,0.5044,0.6298,0.5044,False,False,True,True,True,True,type-C: both gates wrong; set is genuinely hard,0.19269999999999998
naturalqs,llama3,when was coffee first made into a drink,"According to the provided context, the world's first cup of coffee was yielded by dissolving roasted beans in hot water after they were raked from the embers. This event is described as taking place in a nearby monastery, but it is noted that this story may be apocryphal and not actually written down until 1671, which would be 800 years later.

So, based on the context, coffee was first made into a drink when the roasted beans were dissolved in hot water.","According to the provided context, the earliest substantiated evidence of either coffee drinking or knowledge of the coffee tree is from the 15th century, in the Sufi monasteries of Yemen. Additionally, it is mentioned that ""The roasted beans were quickly raked from the embers , ground up , and dissolved in hot water , yielding the world 's first cup of coffee"". Therefore, based on this context, I would answer:

Coffee was first made into a drink in the 15th century, in the Sufi monasteries of Yemen.","According to the provided context, the world's first cup of coffee was yielded by dissolving roasted beans in hot water after they were raked from the embers. This event is described as taking place in a nearby monastery, but it is noted that this story may be apocryphal and not actually written down until 1671, which would be 800 years later.

However, the earliest credible evidence of coffee drinking or knowledge of the coffee tree appears to be from the middle of the 15th century, in Yemen's Sufi monasteries.",-1.0,-1.0,0.7522,0.6594,0.5727,0.472,False,False,True,0.6405,0.6707,0.6405,False,False,False,False,True,False,type-C: both gates wrong; set is genuinely hard,0.1874
pubmedqa,mistral,Patient-Controlled Therapy of Breathlessness in Palliative Care: A New Therapeutic Concept for Opioid Administration?," Based on the provided context, it appears that the study was investigating the effectiveness of patient-controlled therapy (PCT) systems for reducing breathlessness in patients with advanced disease. The study found that opioid PCT can be an effective therapeutic method to reduce breathlessness in these patients, as evidenced by a decrease in self-reported numeric rating scale of current breathlessness. However, the context does not provide information on whether this is a new therapeutic concept for opioid administration in palliative care."," Based on the provided context, it appears that patient-controlled therapy (PCT) of breathlessness with opioids is being investigated as a potential new therapeutic concept in palliative care. However, the text does not explicitly state that it is a ""new"" concept, but rather mentions that its effectiveness and feasibility are being studied. The context also suggests that this method has been used in 18 out of 815 patients with advanced disease and refractory breathlessness."," Based on the provided context, it appears that patient-controlled therapy (PCT) of breathlessness in palliative care is not a new therapeutic concept for opioid administration as it was being investigated and found to be effective in the study discussed. However, the study only involved 18 patients, so it may not yet represent a widely adopted practice.",-1.0,-1.0,0.4223,0.6307,0.6175,0.4472,False,False,True,0.5372,0.5627,0.5367,False,False,True,False,True,True,"type-A: gate fired, refinement made it worse",0.18350000000000005
triviaqa,mistral,What play was President Lincoln watching the night he was assassinated in 1865?," The play that President Lincoln was watching the night he was assassinated in 1865, according to the provided context, is not explicitly stated. However, it is known that Lincoln attended the play Our American Cousin at Ford's Theatre on that fateful night. But the context does mention an earlier encounter between Lincoln and Booth in a play called The Marble Heart at Ford's Theatre on November 9, 1863."," I cannot find this information in the provided context. The context only mentions that Lincoln was attending the play Our American Cousin at Ford's Theatre, not the specific play he was watching the night he was assassinated."," The play that President Lincoln was watching the night he was assassinated in 1865, according to the provided context, is not explicitly stated. However, it is known that Lincoln attended the play Our American Cousin at Ford's Theatre on that fateful night. But the context does mention an earlier encounter between Lincoln and Booth in a play called The Marble Heart at Ford's Theatre on November 9, 1863, but this was before the assassination.",-1.0,-1.0,0.5461,0.6373,0.4799,0.4924,False,True,True,0.6004,0.6127,0.6004,False,False,False,False,True,False,type-C: both gates wrong; set is genuinely hard,0.14489999999999997
hotpotqa,qwen2.5,Which port city lies approximately 25 km north of the Lingnan Fine Arts Museum?,"I cannot find this information in the provided context. The context mentions that Taipei is about 25 km southwest of Keelung, but does not provide a distance or direction from Keelung to the Lingnan Fine Arts Museum.","I cannot find this information in the provided context. The context states that the museum is about 25 km southwest of Keelung, but it does not provide information about a port city lying approximately 25 km north of the Lingnan Fine Arts Museum.","I cannot find this information in the provided context. The context mentions that Taipei is about 25 km southwest of Keelung, but does not provide the distance or direction from Keelung to the Lingnan Fine Arts Museum.",-1.0,-1.0,0.3891,0.576,0.7381,0.4749,False,False,True,0.5629,0.5652,0.5625,False,False,True,False,True,True,"type-A: gate fired, refinement made it worse",0.10109999999999997
hotpotqa,mistral,"Out of the actors who have played the role of Luc Deveraux in the Universal Soldier franchise, which actor has also starred in the movies Holby City, Doctor Strange, the Bourne Ultimatum and Zero Dark Thirty?"," I cannot find this information in the provided context. The context only mentions Jean-Claude Van Damme and Matt Battaglia as actors who have portrayed Luc Deveraux in the Universal Soldier franchise, but it does not mention any other films they may have starred in outside of the franchise."," I cannot find this information in the provided context. The actors mentioned in the context are Jean-Claude Van Damme and Matt Battaglia, neither of whom have been associated with the movies Holby City, Doctor Strange, the Bourne Ultimatum, or Zero Dark Thirty."," I cannot find this information in the provided context. The context only mentions Jean-Claude Van Damme and Matt Battaglia as actors who have portrayed Luc Deveraux, but it does not provide any information about their roles in other films such as Holby City, Doctor Strange, The Bourne Ultimatum, or Zero Dark Thirty.",-1.0,-1.0,0.7209,0.5607,0.5919,0.4651,False,False,True,0.7012,0.6784,0.7012,False,False,False,False,True,False,type-C: both gates wrong; set is genuinely hard,0.09559999999999996
pubmedqa,mistral,Are reports of mechanical dysfunction in chronic oro-facial pain related to somatisation?," Based on the provided context, it is not explicitly stated that reports of mechanical dysfunction in chronic oro-facial pain are related to somatization. However, the text does suggest a potential association between these mechanical factors (teeth grinding and facial trauma) and the reporting of other frequently unexplained syndromes, which could be interpreted as a form of somatization. But it's important to note that this is not a definitive conclusion based on the provided context."," Yes, according to the provided context, there seems to be a relationship between certain mechanical factors (teeth grinding and facial trauma) and chronic oro-facial pain. However, the text does not explicitly state that this relationship is related to somatization. The term ""somatization"" is not mentioned in the context."," Based on the provided context, it is not explicitly stated whether reports of mechanical dysfunction in chronic oro-facial pain are related to somatization. However, the text does mention that these mechanical factors (teeth grinding and facial trauma) were commonly associated with the reporting of other frequently unexplained syndromes, which could potentially be interpreted as a form of somatization. But without a clear definition or confirmation of somatization in the context, it's not possible to definitively say that they are related.",-1.0,-1.0,0.0699,0.4994,0.5566,0.433,True,False,True,0.585,0.6155,0.5882,False,False,True,True,True,True,type-C: both gates wrong; set is genuinely hard,0.06640000000000001
pubmedqa,mistral,Do mutations causing low HDL-C promote increased carotid intima-media thickness?," I cannot find this information in the provided context. The context only mentions that cIMT was measured in individuals with mutations causing low HDL-C, but it does not provide information about whether these mutations promote increased carotid intima-media thickness."," I cannot find this information in the provided context. The context discusses studies related to RHR, casual high BP, optotypes, and visual acuity, but it does not provide any direct link between mutations causing low HDL-C and increased carotid intima-media thickness."," I cannot find this information in the provided context. The context only discusses the comparison between cases with genetic variations leading to low HDL-C and controls, but it does not provide information about whether these mutations promote increased carotid intima-media thickness.",-1.0,-1.0,0.2474,0.5203,0.4121,0.4578,False,True,True,0.4327,0.452,0.432,False,False,True,False,True,True,"type-A: gate fired, refinement made it worse",0.0625
naturalqs,llama3,where do they drop in game of games,"I cannot find this information in the provided context. The context only talks about different games and their rules, but does not mention anything about dropping something in a specific location.","I cannot find this information in the provided context. The context only mentions ""Aw Snap"" and ""Know or Go"", but does not mention a specific game called ""Game of Games"".","I cannot find this information in the provided context. The context only talks about different games and their rules, but does not mention anything about dropping something in a specific game.",-1.0,-1.0,0.0455,0.5224,0.7544,0.4618,False,False,True,0.3644,0.3983,0.3644,False,False,True,False,True,True,"type-A: gate fired, refinement made it worse",0.06059999999999999
pubmedqa,llama3,Is adjustment for reporting heterogeneity necessary in sleep disorders?,"According to the provided context, it can be inferred that adjusting for reporting heterogeneity is necessary. The text states ""After correction, age, the number of comorbidities, and regular exercise were significantly associated with a greater severity of sleep-related problems; sex was no longer a significant factor."" This suggests that correcting for reporting heterogeneity changed the significance of some factors, implying that it is necessary to account for such differences in order to accurately estimate associations.","According to the provided context, it seems that adjustment for reporting heterogeneity is relevant in self-reports of sleep-related problems. The research uses vignettes to elucidate factors associated with sleep disorders and mentions ""adjustment for reporting heterogeneity in self-reports"". This suggests that adjusting for reporting heterogeneity may be necessary to accurately understand sleep disorders.","According to the provided context, it is mentioned that ""After correction [for reporting heterogeneity], age, the number of comorbidities, and regular exercise were significantly associated with a greater severity of sleep-related problems; sex was no longer a significant factor."" This suggests that adjustment for reporting heterogeneity is necessary in order to accurately estimate the associations between socio-demographic and lifestyle factors and sleep disorders.",-1.0,-1.0,0.2002,0.5197,0.6286,0.4909,False,False,True,0.5493,0.5627,0.5493,False,False,True,False,True,True,"type-A: gate fired, refinement made it worse",0.028800000000000048
triviaqa,mistral,Who is the only dwarf in the Disney tale of Snow White who wears spectacles?," I cannot find this information in the provided context as it does not pertain to the Disney tale of Snow White. The context only discusses the production and release of the film, but not the individual characters within it."," I cannot find this information in the provided context. The context does not mention any specific dwarfs from the tale of Snow White, their appearances, or their attributes like wearing spectacles."," I cannot find this information in the provided context as it does not pertain to the Disney tale of Snow White. The context only discusses the production and release of the film, but not the characters within it.",-1.0,-1.0,-0.0391,0.4997,0.6039,0.4724,True,False,True,0.3932,0.5254,0.3932,False,False,True,True,True,True,type-C: both gates wrong; set is genuinely hard,0.02729999999999999
pubmedqa,llama3,Israeli hospital preparedness for terrorism-related multiple casualty incidents: can the surge capacity and injury severity distribution be better predicted?,I cannot find this information in the provided context. The context only discusses Hospital Multiple Casualty Incidents (HMCI) and does not mention predicting surge capacity or injury severity distribution for terrorism-related multiple casualty incidents.,I cannot find this information in the provided context. The text does not mention predicting surge capacity or injury severity distribution. It only discusses the definition of Hospital Multiple Casualty Incidents (HMCI) and the outcome measures used to evaluate hospital readiness for such incidents.,"I cannot find this information in the provided context. The text does not mention ""surge capacity"" or ""injury severity distribution"" in relation to Israeli hospital preparedness for terrorism-related multiple casualty incidents.",-1.0,-1.0,0.366,0.4847,0.7008,0.4825,True,False,True,0.557,0.5462,0.5639,False,False,True,True,True,True,type-C: both gates wrong; set is genuinely hard,0.0022000000000000353
pubmedqa,llama3,Do mutations causing low HDL-C promote increased carotid intima-media thickness?,"According to the provided context, the answer is:

No, despite significantly lower HDL cholesterol (0.67 vs. 1.58 mmol/l) and apolipoprotein A-I levels (96.7 vs. 151.4 mg/dl), cIMT was nearly identical between cases (0.66+/-0.17 cm) and controls (0.65+/-0.18 cm).","According to the provided context, it can be inferred that there is a relationship between low HDL resulting from genetic variation and early atherosclerosis, as evidenced by the measurement of carotid intima-media thickness (cIMT) in cases comprising 10 different mutations in LCAT, ABCA1, and APOA1. Therefore, I would answer:

Yes, mutations causing low HDL-C may promote increased carotid intima-media thickness.","According to the provided context, the answer is:

No, despite significantly lower HDL cholesterol (0.67 vs. 1.58 mmol/l) and apolipoprotein A-I levels (96.7 vs. 151.4 mg/dl), cIMT was nearly identical between cases (0.66+/-0.17 cm) and controls (0.65+/-0.18 cm).",-1.0,-1.0,0.2474,0.4517,0.6751,0.4517,True,False,True,0.4327,0.452,0.432,False,False,True,True,True,True,type-C: both gates wrong; set is genuinely hard,0.0
triviaqa,mistral,What was the previous name of the city of Maputo?, Lourenço Marques, Lourenço Marques, Lourenço Marques,-1.0,-1.0,0.6706,0.4051,0.4051,0.4051,True,True,True,0.6449,0.7199,0.6449,False,False,False,True,True,False,type-B: gate did not fire on baseline-incoherent set,0.0
pubmedqa,mistral,Prompting Primary Care Providers about Increased Patient Risk As a Result of Family History: Does It Work?," Yes, prompting primary care providers about increased patient risk as a result of family history was implemented in the study, but there was no significant change in problem summary list documentation of risk status or screening interventions for any of the 6 diseases as a result."," Yes, prompting primary care providers about increased patient risk as a result of family history does work to some extent. According to the provided context, during the study period, 53.5% of visits had a physician response that included reviewing family history, discussing family history, or reviewing family history and ordering tests/referrals. However, more research is needed to compare the efficacy of these methods with a high-quality usual care system for enhancing screening."," Yes, prompting primary care providers about increased patient risk as a result of family history was implemented in the study, but there was no significant change in problem summary list documentation of risk status or screening interventions for any of the 6 diseases as a result.",-1.0,-1.0,0.3458,0.3654,0.6447,0.3654,True,False,True,0.5966,0.5793,0.5972,False,False,True,True,True,True,type-C: both gates wrong; set is genuinely hard,0.0
